ID,Tags,Created At,Text
1391181081408327686,,Sat May 08 23:59:51 +0000 2021,A massive hike in electricity prices and taxes at a time when a new Covid wave has deepened economic uncertainty would be disastrous for the poor and the middle class in #Pakistan.
1391181036692951045,,Sat May 08 23:59:40 +0000 2021,"@MuqaddasPirzad2 😔😔 please don’t post happy mother day ? 😔 cuz due to COVID 19, many people loss their parents"
1391180207139196931,,Sat May 08 23:56:22 +0000 2021,"26th Sehri mubarak to all 😊🙏

May ALLAH SWT forgive us...
Safe us form coronavirus . Ameen 🤲

Special prayers for covid situation in India 🤲 https://t.co/w5PmVcfYsw"
1391179307905585154,,Sat May 08 23:52:48 +0000 2021,"Pre Covid story: 
There were those days too when I used to place an order of full carton of TOP POPS for my best friend because he used to stay in a hostel and full study mode was on. And he used to enjoy eating Top pops with his studies😂"
1391178707763699716,,Sat May 08 23:50:25 +0000 2021,"26th Sehri mubarak to all 😊🙏

May ALLAH SWT forgive us...
Safe us form coronavirus . Ameen 🤲

Special prayers for covid situation in India 🤲 https://t.co/w5PmVcfYsw"
1391175135932125197,KabulBlast,Sat May 08 23:36:13 +0000 2021,Terrorists attacked on school and innocent children. They are cruel. This time whole world is suffered virus Covid. 19.Allah is angry with us. #KabulBlast
1391173542369243141,,Sat May 08 23:29:53 +0000 2021,"Visited Anarkali bazar &amp; surrounding areas to inspect the corona SOPs/lockdown implementation &amp; distributed masks to the people.
I urge the citizens to cooperate wd the administration to contain the spread of coronavirus &amp; implement the SOPs during lock down.
Stay home Stay Safe https://t.co/pKJP5TOSo9"
1391173461918236673,,Sat May 08 23:29:34 +0000 2021,"Institutions are closed...
Psl was cancelled...
Lockdown is imposed...
This variant is spreading...
Positivity ratio is almost 10%...
We are experiencing the highest deaths till date....
BUT EXAMS WILL HAPPEN!
@Shafqat_Mahmood
@DrMuradPTI
@RajaYassirPTI

#shafqatsbruiningcareers"
1391173193398951948,COVID19,Sat May 08 23:28:30 +0000 2021,Watch | '1 Million Indians May Have Already Died of #COVID19  https://t.co/pUfXaqdkjg via @thewire_in
1391172653604646915,,Sat May 08 23:26:22 +0000 2021,"How is the new COVID strain different?

1. Increased virulence
2. Pushing more patients into critical care
3. Unlike first and second wave, also affecting children age 1-10

Time to follow SOPS TWICE as religiously as before. 

Stay safe, keep family safe, get vaccinated"
1391172521865752577,India Covid,Sat May 08 23:25:50 +0000 2021,"Praying for #India as the country battles the worst #Covid-19 surge the world has witnessed. Let's all - irrespective of the place we live in - strictly follow the SOPs to avoid further burdening our healthcare systems.

#HumanityFirst  #PakistanstandswithIndia #indianeedoxygen"
1391170383303389191,,Sat May 08 23:17:20 +0000 2021,"@Shafqat_Mahmood still nobody is able to comprehend your decision.
You and your @EduMinistryPK is answerable to all these students and their families for risking their lives and exposing them to this deadly virus!
@RajaYassirPTI
@DrMuradPTI
@SaeedGhani1
#shafqatsbruiningcareers"
1391170153606520833,shafqatsbruiningcareers,Sat May 08 23:16:25 +0000 2021,"@Shafqat_Mahmood still nobody is able to comprehend your decision.
You and your @EduMinistryPK is answerable to all these students and their families for risking their lives and exposing them to this deadly virus!
@RajaYassirPTI
@DrMuradPTI
@SaeedGhani1
#shafqatsbruiningcareers"
1391169274199384064,,Sat May 08 23:12:56 +0000 2021,Me watching lockdown extension news every other day. https://t.co/hCkpc7pRGg
1391167959704522753,,Sat May 08 23:07:42 +0000 2021,"Pakistan made single shot COVID vaccine will be available by the start of the next month.

Asad Umer"
1391167159749992448,HappyMothersDay,Sat May 08 23:04:32 +0000 2021,"Let’s not highlight MOTHER’S day and FATHER’S day this year!
Countless families have lost their parents due to COVID...
Our act will add to misery of those people....
Try to take care of everyone and pray for the long life of our parents...
#HappyMothersDay"
1391166635134885890,,Sat May 08 23:02:27 +0000 2021,"Institutions are closed...
Psl was cancelled...
Lockdown is imposed...
This variant is spreading...
Positivity ratio is almost 10%...
We are experiencing the highest deaths till date....
BUT EXAMS WILL HAPPEN!
@Shafqat_Mahmood
@DrMuradPTI
@RajaYassirPTI

#shafqatsbruiningcareers"
1391166488837492744,shafqatsbruiningcareers,Sat May 08 23:01:52 +0000 2021,"Institutions are closed...
Psl was cancelled...
Lockdown is imposed...
This variant is spreading...
Positivity ratio is almost 10%...
We are experiencing the highest deaths till date....
BUT EXAMS WILL HAPPEN!
@Shafqat_Mahmood
@DrMuradPTI
@RajaYassirPTI

#shafqatsbruiningcareers"
1391166204371476487,,Sat May 08 23:00:44 +0000 2021,@M_furqan191 @Asad_Umar Sinopharm Vaccine contains killed virus. So that can not cause disease
1391165172098736128,,Sat May 08 22:56:38 +0000 2021,"@mahmudzulfiqar_ @ZaidZamanHamid COVID IS JUAT A CODE ... IN NUMBERING , IT IS A MARK OF THE BEAST 666 (DEVIL NUMBER)"
1391164669163933696,,Sat May 08 22:54:38 +0000 2021,"@M_furqan191 @Asad_Umar Dear after 1st jab , it takes 21 days to starts it actions and the side effects you mentioned are not related to Vaccine. Covid virus  incubation period is 7 days. After 7 days symptoms appear. So these patients catch virus before Sinopharm vaccination"
1391164601300041735,,Sat May 08 22:54:22 +0000 2021,@Shafqat_Mahmood Sir this isn’t the way to treat us we students don’t have enough time left to study and the sources to study are also closed due to covid now you tell us what should we do
1391164323821674506,,Sat May 08 22:53:16 +0000 2021,@Afifa62708362 Lockdown k bd 🙈
1391164280511287300,,Sat May 08 22:53:05 +0000 2021,"Wonderful news. According to Asad Umar, Pakistan’s NIH in final stages of developing CANSINO VACCINE against COVID within the country. After necessary tests, this vaccine should be available by end May this year. Keep up the good NIH. We Pray for your success"
1391163393915170819,,Sat May 08 22:49:34 +0000 2021,"Never ending zionism? Kabul attack? Covid? Ya Rab. Ease the hardships of the Muslim ummah and give everyone the strength to conquer this oppression. 
Ameen ya rab ul ala meen. ❤️"
1391162754841649153,,Sat May 08 22:47:01 +0000 2021,"Aur bhi dukh hain zamanay mai muhabbat kay siwa"" Faiz Ahmad Faiz wrote these words long time ago and during these hard times we can actually see that how Covid-19 took a lot of close people from us. Every single second people are dying, breaking down and losing their shit."
1391162584297005061,,Sat May 08 22:46:21 +0000 2021,@mona_qau Covid SOP's..🤣🤣🤣
1391162016795086852,,Sat May 08 22:44:06 +0000 2021,Indian Supreme Court orders immediate de-congestion of prisons in view of Covid-19 surge The Supreme Court has taken a humanitarian view of the 4-lakh+prison population inside overcrowded jails even as the 2 nd wave of the pandemic continues its devastating run across the country
1391161872750202885,,Sat May 08 22:43:31 +0000 2021,"BBC News - India's Covid crisis delivers a blow to brand Modi. The Indian government led by the Madman Modi is not behaving in a responsible manner by allowing Hindu Festivals, Election rallies, that has resulted in millions of more deaths.
https://t.co/ElTgAwA12B"
1391161824771465220,,Sat May 08 22:43:20 +0000 2021,"@commissionerlhr You are more than welcome. 
Sir it’s observed that E-commerce institutions are treating employees inhumanly just bcoz they are in exception for lockdown. 
Is there any measure to have check on these PVT institutions either they actually following SOP’s or not. 
Kind regards."
1391161231717937152,CanSinoBIO,Sat May 08 22:40:58 +0000 2021,"Alhamdullilah Pakistan has started preparation of COVID Vaccine #CanSinoBIO in @NIH_Pakistan 
First batch under process.
Vaccine will be available for use by the end of month after undergoing Quality Control Trial.
In Shaa Allah https://t.co/bEyheOsLHo"
1391159951993749506,RamadanKareem ISLAM__Religion_of__ethics,Sat May 08 22:35:53 +0000 2021,"I would like to thank 🙏🏻 all riders working for companies delivering across  🇵🇰 as they are working night &amp; day because of lockdown, pls offer them iftar or at least water if they come at your doorstep
#RamadanKareem #ISLAM__Religion_of__ethics"
1391159187028201478,,Sat May 08 22:32:51 +0000 2021,"Coronavirus doesn't spread from touching things. In fact ""risk of transmission from touching a surface, while small, is elevated indoors. Outdoors, the sun &amp; other factors can destroy viruses."" Disinfecting surfaces is not an effective way to reduce risk.
https://t.co/eWbsHQLuuD"
1391157646284185601,,Sat May 08 22:26:43 +0000 2021,"@Shahidmasooddr Except business class, common man is always at forefront to help the common man. I have seen this in last lockdown."
1391157379065073673,,Sat May 08 22:25:40 +0000 2021,"ADCs continue to visit Ramadan Bazaars to monitor the quality of fruits, vegetables &amp; other essential items and are ensuring max relief for people before Eid.

DC control list prices and Corona SOPs implementation are being closely monitored during the lockdown. https://t.co/gU6t2NRtwt"
1391155435135283203,,Sat May 08 22:17:56 +0000 2021,@sarimrashid I hope covid remains inactive and they get negative without effects. Stay blessed
1391154983895191556,,Sat May 08 22:16:09 +0000 2021,How did Londoners Voted... specially in Covid
1391152865658482688,COVID19 health Telemedicine,Sat May 08 22:07:44 +0000 2021,"Those who working in health sector should think about alternative health delievery system such as telemedicine during COVID-19, herein empirical evidence. #COVID19 #health #Telemedicine

https://t.co/YYzufgHzfY"
1391152411889242113,Lahore,Sat May 08 22:05:56 +0000 2021,Covid situation is getting so bad #Lahore
1391152058565369861,,Sat May 08 22:04:31 +0000 2021,My heart is aching for all the people who lost their mothers to covid in this pandemic
1391151473195724800,,Sat May 08 22:02:12 +0000 2021,"Wonderful news. According to Asad Umar, Pakistan’s NIH in final stages of developing CANSINO VACCINE against COVID within the country. After necessary tests, this vaccine should be available by end May this year. Keep up the good NIH. We Pray for your success"
1391151452115066883,COVID19 MothersDay2021,Sat May 08 22:02:07 +0000 2021,"Let's not highlight Mother's day and Father's day this year? Please. 

Countless families lost their mothers and fathers because of covid. 

This show off will only add to the misery of those who lost them.

#COVID19 #MothersDay2021"
1391148700060225553,,Sat May 08 21:51:11 +0000 2021,"As per the guidelines issued by NCOC all the tourist areas, resorts, hotels in and around tourist spots &amp; public parks, Museums and all Heritage Sites will remain Closed from 08 May 2021 to 16 May 2021 to contain the spread of Covid-19 during Eid-ul-Fitar Holidays.
#TDCP#Covid19 https://t.co/0kuwkP06Wu"
1391146983151243264,lockdown,Sat May 08 21:44:21 +0000 2021,Babus and Bayonets have decided #lockdown from 8 May.They made an easy way otherwise they wld ve to give comprehensive policy with its implementation but shocked to see chocking roads.Jam packed Malls.Swamped Bus stations. Wandering it will lessen or aggravate the pandemic!
1391146932387651589,,Sat May 08 21:44:09 +0000 2021,"lockdown is a good excuse by ghar wale to stop you from shopping. bhae online le den, itna kya masla ha? 🤷🏻‍♀️🙄"
1391143979757051909,,Sat May 08 21:32:25 +0000 2021,@Mohtermalaila Covid ??
1391142721340035076,ASTROLOGY,Sat May 08 21:27:25 +0000 2021,"@Google #ASTROLOGY VIRGO HIGH LIGHTS JUNE 2021 FOR
ALL PARTS OF THE WORLD.
DEFFICULTIES TO GET SUITABLE MATCH FOR YOUNG BOYS AND GIRLS.PROGRAM TO PURCHASE VEHICLE.BURDEN ON HEALTH.ANOTHER ATTACK OF CORONA VIRUS EXPECTED.ALL
NECESSARY PRECAUTIONARY MEASURES MUST BE ADOPTED.##"
1391141647388393480,,Sat May 08 21:23:09 +0000 2021,"As I keep reading and hearing news of people suffering from COVID-19 globally, I do what I can: pray for all of them in my after-namaz dua.

Despair, pain, loneliness, waiting, loss...
InshaAllah, this too shall pass."
1391141367615737862,,Sat May 08 21:22:02 +0000 2021,Model town link road pr lockdown ki Chand Raat manaty huwy  😂 https://t.co/WLi0Cdnztc
1391139430585487361,CanSinoBIO,Sat May 08 21:14:21 +0000 2021,"Alhamdullilah Pakistan has started preparation of COVID Vaccine #CanSinoBIO in @NIH_Pakistan 
First batch under process.
Vaccine will be available for use by the end of month after undergoing Quality Control Trial.
In Shaa Allah https://t.co/bEyheOsLHo"
1391138708498403328,CanSinoBIO,Sat May 08 21:11:28 +0000 2021,"Alhamdullilah Pakistan has started preparation of COVID Vaccine #CanSinoBIO in @NIH_Pakistan 
First batch under process.
Vaccine will be available for use by the end of month after undergoing Quality Control Trial.
In Shaa Allah https://t.co/bEyheOsLHo"
1391138605649866752,,Sat May 08 21:11:04 +0000 2021,"wait does covid like not exist in america...? the whole world out here dying w lockdowns,, while ppl there are jus livin I’m so confused"
1391137349145436162,,Sat May 08 21:06:04 +0000 2021,"@Google#ASTROLOGY LEO HIGH LIGHTS JUNE 2021 FOR ALL PARTS OF THE WORLD.
AVOID UN NECESSARY EXPENDITURES.ENEMIES WILL BE
EXTRA ACTIVE.GIVE PRFERENCE
TO YOUR OWN AND NATIONAL https://t.co/wLYC6pq9Ut MAY EFFECT.
AVOID CORONA VIRUS.ALL NECESSARY PRECAUTIONARY MEASURES MUST BE ADOPTED"
1391136386929938432,India Covid,Sat May 08 21:02:15 +0000 2021,"Praying for #India as the country battles the worst #Covid-19 surge the world has witnessed. Let's all - irrespective of the place we live in - strictly follow the SOPs to avoid further burdening our healthcare systems.

#HumanityFirst  #PakistanstandswithIndia #indianeedoxygen"
1391134092058578944,,Sat May 08 20:53:08 +0000 2021,@tadhkeeru Not gonna do All that this year.. but will InShaaAllah once the world is covid free InShaaAllah💗
1391132890822582272,,Sat May 08 20:48:21 +0000 2021,@a_aliabbas I saw this today ... :P ab tau post covid cafe stories are very different
1391131060033966081,,Sat May 08 20:41:05 +0000 2021,@SamaritansPurse @SamaritansPurse please help us I have tried to contact with your organization and email them but did not get any respond. We are Christian family from Pakistan. My father is a daily wages worker. We are in hard situation because of Covid and lock down. Please help us
1391130878710063105,CanSinoBIO,Sat May 08 20:40:22 +0000 2021,"Alhamdullilah Pakistan has started preparation of COVID Vaccine #CanSinoBIO in @NIH_Pakistan 
First batch under process.
Vaccine will be available for use by the end of month after undergoing Quality Control Trial.
In Shaa Allah https://t.co/bEyheOsLHo"
1391130644055535617,CanSinoBIO,Sat May 08 20:39:26 +0000 2021,"Alhamdullilah Pakistan has started preparation of COVID Vaccine #CanSinoBIO in @NIH_Pakistan 
First batch under process.
Vaccine will be available for use by the end of month after undergoing Quality Control Trial.
In Shaa Allah https://t.co/bEyheOsLHo"
1391130424844328961,India Covid,Sat May 08 20:38:33 +0000 2021,"Praying for #India as the country battles the worst #Covid-19 surge the world has witnessed. Let's all - irrespective of the place we live in - strictly follow the SOPs to avoid further burdening our healthcare systems.

#HumanityFirst  #PakistanstandswithIndia #indianeedoxygen"
1391128501747605510,,Sat May 08 20:30:55 +0000 2021,"The experience over the last year has shown that the only way to overcome the virus is to vaccinate as many people as early as possible. It is criminal that the government did not take timely steps to buy vaccines in sufficient quantity, and the result is a surge in infections."
1391127060815532033,,Sat May 08 20:25:11 +0000 2021,"@KhurramHusain Not to forget, you were a staunch critic of the PM opposing lockdowns last year and doubted his concern for daily wagers. Now, you are quoting figures on job losses thanks to that lockdown and ignoring that the PM's policy of opening up was right: it led to a V-shaped recovery."
1391127011368873984,,Sat May 08 20:25:00 +0000 2021,@washingtonpost Indians adopted shield against covid😂😂😂 https://t.co/2wJoRwzvbN
1391126954837954570,,Sat May 08 20:24:46 +0000 2021,@KhurramHusain So you mentioned the jobs lost as per PBS during peak COVID-19 last year but missed the same report saying those jobs were gained back in a V-shaped recovery? Why is that so? Perhaps because that kills your narrative of persistently high unemployment amid record corporate profits https://t.co/IrLEwM4DR5
1391126944339611658,,Sat May 08 20:24:44 +0000 2021,The lockdown if we didn’t have all the gadgets? https://t.co/SroRMbA5WK
1391126744414003201,CanSinoBIO,Sat May 08 20:23:56 +0000 2021,"Alhamdullilah Pakistan has started preparation of COVID Vaccine #CanSinoBIO in @NIH_Pakistan 
First batch under process.
Vaccine will be available for use by the end of month after undergoing Quality Control Trial.
In Shaa Allah https://t.co/bEyheOsLHo"
1391126460665114627,,Sat May 08 20:22:48 +0000 2021,"Coronavirus doesn't spread from touching things. In fact ""risk of transmission from touching a surface, while small, is elevated indoors. Outdoors, the sun &amp; other factors can destroy viruses."" Disinfecting surfaces is not an effective way to reduce risk.
https://t.co/eWbsHQLuuD"
1391126109950029834,,Sat May 08 20:21:25 +0000 2021,"Alhamdulillah, my mother is finally covid free. Thank you all who keep texting me any asking me about her health. You all are Gem. 🙂"
1391125841996832773,CanSinoBIO,Sat May 08 20:20:21 +0000 2021,"Alhamdullilah Pakistan has started preparation of COVID Vaccine #CanSinoBIO in @NIH_Pakistan 
First batch under process.
Vaccine will be available for use by the end of month after undergoing Quality Control Trial.
In Shaa Allah https://t.co/bEyheOsLHo"
1391124326276079619,,Sat May 08 20:14:19 +0000 2021,"@PakPMO @HamidMirPAK @Shafqat_Mahmood 
In a programe with hamid mir sahib Edu minister was saying, exams will not be intruptted due covid-19 but the reality is that the @BZUniversity is not conducting the LLB 3 years exams since Jan 2020. Students are wasting their precious time due to"
1391123501034115073,IsraeliAttackonAlAqsa,Sat May 08 20:11:03 +0000 2021,"A writing on the wall of Masjid Aqsa""A nation whose commander is Mohammed (PBUH) can never be surrendered.""
When india's covid situation was worse whole world showed sympathy with them. Now they all sit still. where is UN and other human rights commision.

#IsraeliAttackonAlAqsa https://t.co/HPHPVdvTx9"
1391123043003555840,,Sat May 08 20:09:13 +0000 2021,"Visited Anarkali bazar &amp; surrounding areas to inspect the corona SOPs/lockdown implementation &amp; distributed masks to the people.
I urge the citizens to cooperate wd the administration to contain the spread of coronavirus &amp; implement the SOPs during lock down.
Stay home Stay Safe https://t.co/pKJP5TOSo9"
1391121456826830850,,Sat May 08 20:02:55 +0000 2021,only he can stop covid https://t.co/RqMfcaDXaj
1391120731187122178,,Sat May 08 20:00:02 +0000 2021,First COVID-19 vaccine jab received. Took less than 10 minutes from parking car to getting the prick. At Expo Centre
1391120714506412032,IndianNuclearSecurityExposed,Sat May 08 19:59:58 +0000 2021,It can’t be ruled out that India  might be planning some kinda mischief to placate Pak. They need to divert public attention away from their bungling up of Covid response. Nothing is off limits in Modi’s books. #IndianNuclearSecurityExposed
1391120166352826369,,Sat May 08 19:57:48 +0000 2021,COVID is bad for our mental health. PERIOD
1391119914182791170,CanSinoBIO,Sat May 08 19:56:47 +0000 2021,"Alhamdullilah Pakistan has started preparation of COVID Vaccine #CanSinoBIO in @NIH_Pakistan 
First batch under process.
Vaccine will be available for use by the end of month after undergoing Quality Control Trial.
In Shaa Allah https://t.co/bEyheOsLHo"
1391118914789253122,,Sat May 08 19:52:49 +0000 2021,"Visited Anarkali bazar &amp; surrounding areas to inspect the corona SOPs/lockdown implementation &amp; distributed masks to the people.
I urge the citizens to cooperate wd the administration to contain the spread of coronavirus &amp; implement the SOPs during lock down.
Stay home Stay Safe https://t.co/pKJP5TOSo9"
1391118220711677959,,Sat May 08 19:50:04 +0000 2021,@Chahal_Shekhar That's why COVID-19 spreading in india
1391117753248059393,,Sat May 08 19:48:12 +0000 2021,@ProdigyDDK Please donate it to me we affected too much by Covid lost job domestic conditions getting worse day by day please donate it to
1391116149836947461,,Sat May 08 19:41:50 +0000 2021,@ProdigyDDK Brother please help us we are in hard situation because of Covid and lock down. Your little support can help us to buy some household stuff and vegetables of this month
1391115837365489665,,Sat May 08 19:40:35 +0000 2021,@ProdigyDDK Hi dear please help us we are in hard situation because of Covid and lock down.
1391114859442495488,,Sat May 08 19:36:42 +0000 2021,"Pakistan made single shot COVID vaccine will be available by the start of the next month.

Asad Umer"
1391114189821861891,,Sat May 08 19:34:03 +0000 2021,"The democracy can only WORK and find its way IF the judicary is doing JUSTICE.
Judiciary is like boot sector, when virus enters there then only you FORMAT. The old parties made judiciary their pet. wont work!

Roznama Dunya: کالم اور مضامین :- خورشید ندیم https://t.co/NY14H2zFgQ https://t.co/UJh8DuJ6mU"
1391113913211793416,,Sat May 08 19:32:57 +0000 2021,"@VishalT39076171 @Aisha12591485 @AbhilashDubey71 @Hussain4Justice That's our matter to deal with, you guys take care of covid-19."
1391111792693231623,CancelAllExams,Sat May 08 19:24:31 +0000 2021,Please cancel exams as students are extremely stressed in this obnoxious period of covid #CancelAllExams
1391111239040909315,,Sat May 08 19:22:19 +0000 2021,"Need 1 more piercing :(((
Lockdown kholoo payeiiinnnn"
1391111233277992960,lockdown doge CoronaSecondWave AlAqsaMosque COVID19 MothersDay2021,Sat May 08 19:22:18 +0000 2021,"Eid shopping 🤙🏻
#lockdown #doge #CoronaSecondWave #AlAqsaMosque #COVID19 #MothersDay2021 https://t.co/vVlEnwmCql"
1391109014906445824,CanSinoBIO,Sat May 08 19:13:29 +0000 2021,"Alhamdullilah Pakistan has started preparation of COVID Vaccine #CanSinoBIO in @NIH_Pakistan 
First batch under process.
Vaccine will be available for use by the end of month after undergoing Quality Control Trial.
In Shaa Allah https://t.co/bEyheOsLHo"
1391107823359176709,CanSinoBIO,Sat May 08 19:08:45 +0000 2021,"Alhamdullilah Pakistan has started preparation of COVID Vaccine #CanSinoBIO in @NIH_Pakistan 
First batch under process.
Vaccine will be available for use by the end of month after undergoing Quality Control Trial.
In Shaa Allah https://t.co/bEyheOsLHo"
1391106949962420229,,Sat May 08 19:05:17 +0000 2021,@Asad_Umar Boarder Close Karro pehly bhi Covid waha se he import howa Tha or ab bhi 5 din pehly pori chutti thi on ko
1391106526572695555,CanSinoBIO,Sat May 08 19:03:36 +0000 2021,"Alhamdullilah Pakistan has started preparation of COVID Vaccine #CanSinoBIO in @NIH_Pakistan 
First batch under process.
Vaccine will be available for use by the end of month after undergoing Quality Control Trial.
In Shaa Allah https://t.co/bEyheOsLHo"
1391106447602327552,India Covid,Sat May 08 19:03:17 +0000 2021,"Praying for #India as the country battles the worst #Covid-19 surge the world has witnessed. Let's all - irrespective of the place we live in - strictly follow the SOPs to avoid further burdening our healthcare systems.

#HumanityFirst  #PakistanstandswithIndia #indianeedoxygen"
1391105771006476290,,Sat May 08 19:00:35 +0000 2021,"ADCs continue to visit Ramadan Bazaars to monitor the quality of fruits, vegetables &amp; other essential items and are ensuring max relief for people before Eid.

DC control list prices and Corona SOPs implementation are being closely monitored during the lockdown. https://t.co/gU6t2NRtwt"
1391103784798072832,,Sat May 08 18:52:42 +0000 2021,"India losing 4 media persons a day to Covid-19, as global tally reaches 1,248 https://t.co/3YqiXE4ggF"
1391103625297109000,MaskLagaoPakistan CoronaSecondWave,Sat May 08 18:52:04 +0000 2021,"Mask 😷 &gt;&gt;&gt;&gt;&gt;&gt;&gt; corona virus 
""Your life matters!""

#MaskLagaoPakistan #CoronaSecondWave"
1391102597960982533,,Sat May 08 18:47:59 +0000 2021,@ANI Subhaan Allah. Feeling sorry for the virus
1391101496578789382,,Sat May 08 18:43:36 +0000 2021,‘How Can Modi Be Forgiven?’ India’s COVID-19 Crisis May Be Turning the Middle Class Against the Prime Minister https://t.co/DAcvUlBEfy
1391100635848876033,,Sat May 08 18:40:11 +0000 2021,"@cherryx_rose Same. Like I have yet to watch shows like Money Heist, Queen's Gambit etc. Meri ""will to watch"" ko bhi lockdown lagya ha."
1391100044338679810,,Sat May 08 18:37:50 +0000 2021,"UK variant accounts for 70pc of Covid cases in Pakistan, researcher says https://t.co/vCiqh0QMfi"
1391099629257822213,,Sat May 08 18:36:11 +0000 2021,"UK variant accounts for 70pc of Covid cases in Pakistan, researcher says https://t.co/vCiqh0QMfi"
1391099457035509762,,Sat May 08 18:35:30 +0000 2021,"Visited Anarkali bazar &amp; surrounding areas to inspect the corona SOPs/lockdown implementation &amp; distributed masks to the people.
I urge the citizens to cooperate wd the administration to contain the spread of coronavirus &amp; implement the SOPs during lock down.
Stay home Stay Safe https://t.co/pKJP5TOSo9"
