ID,Tags,Created At,Text
1424096226925031428,,Sat Aug 07 19:52:53 +0000 2021,Covid vaccination in Civil Hospital Quetta halted  https://t.co/TW9rPO1XWH
1424020769412161537,,Sat Aug 07 14:53:03 +0000 2021,COVID-19 related information base is yet to expand. Expect many things which might be contrary to what we know today.
1424018100941381635,,Sat Aug 07 14:42:26 +0000 2021,Sindh to lift coronavirus lockdown on August 9: NCOC https://t.co/4WAEh9QIAV
1424008260370288648,,Sat Aug 07 14:03:20 +0000 2021,Vaccinated against Covid today. https://t.co/3dFHP3fsGF
1423983712002265093,,Sat Aug 07 12:25:47 +0000 2021,What Govt of Balochistan and Health dept is doing pathetic to prevent the Covid-19. The whole district of kohlu who got first doze are unable to get the second doze because of the unavailbilty of the stock. And yet govt claim people are refusal to get vaccinated. @Senator_Baloch
1423955348029902850,,Sat Aug 07 10:33:05 +0000 2021,"Karachi’s positivity ratio down 3pc as fourth Covid wave grips AJK, other regions https://t.co/IqeWcnQM0x"
