ID,Tags,Created At,Text
1422292193419616265,,Mon Aug 02 20:24:18 +0000 2021,Covid infection rate rising in Balochistan: Shahwani https://t.co/94ajRxPpmo
1422289726992748548,,Mon Aug 02 20:14:30 +0000 2021,WHO team briefs Aziz Jamali on Covid in Makran https://t.co/tfcKWJVZci
1422287305847410691,,Mon Aug 02 20:04:53 +0000 2021,94 more contract Covid in Balochistan https://t.co/c4ENaWVL2V
1422245980729118725,,Mon Aug 02 17:20:40 +0000 2021,"WHO experts engaged to assist in Covid Response Services 
Next, we'll assess Kalat and Naseerabad Divisions. North/Quetta and Makran are on the radar but we shouldn't miss other areas. https://t.co/Vc0q664AWT"
1422244703404273672,,Mon Aug 02 17:15:35 +0000 2021,@its_me_axad Lockdown 🤣🤣🤣
1422196335760007174,,Mon Aug 02 14:03:24 +0000 2021,@business @KhalidMamsani 😁thats why usa having largest covid related death. 😁
1422176248076320770,,Mon Aug 02 12:43:34 +0000 2021,New restrictions to be imposed in major cities as COVID-19 cases rise: Asad Umar https://t.co/vzFvPkPTOq
1422175732994826243,,Mon Aug 02 12:41:32 +0000 2021,PM Imran Khan to chair meeting on COVID-19 as fourth wave grips Pakistan https://t.co/C7R81AGvAX
1422105444953346050,,Mon Aug 02 08:02:14 +0000 2021,"""Covid - as we tackle wave 4 in Pakistan, please use masks, avoid crowds and ensure adequate room ventilation.

Vaccination remains a crucial tool in this effort. Over 30 million cumulative doses and over 934,000 doses given, just yesterday""

A quick analysis below, GetVaccinated https://t.co/eo9dfWFDby"
