ID,Tags,Created At,Text
1442520629996097541,,Mon Sep 27 16:04:53 +0000 2021,"@tayyebafridi Tayyeb sb bus covid fatigue shawe de. Will be sharing some exciting data from our variant work, plus other researches coming quite soon as well"
1442499505568600069,,Mon Sep 27 14:40:57 +0000 2021,Pfizer Begins Study of Oral Drug for Prevention of COVID-19 https://t.co/UgOCcBsdRG
1442473051413647373,,Mon Sep 27 12:55:49 +0000 2021,@ImranKhanAnchr Covid-19
1442434708525158401,,Mon Sep 27 10:23:28 +0000 2021,Covid vaccine mandates are put to a test as some New York health care workers refuse shots. https://t.co/7OGNxolksJ
1442427005966983169,,Mon Sep 27 09:52:51 +0000 2021,Brazil’s delegation member to U.N. tests positive for COVID-19 https://t.co/7STjZLicEK
1442423086167384068,,Mon Sep 27 09:37:17 +0000 2021,"@DoreenKiani @DhoIslamabad Pfizer tested its covid mrna vaccine for safety on kids 
Mrna vaccine (not covid vaccine specifically) has taken a decade of testing to develop so we know its quite safe"
1442375220170399748,,Mon Sep 27 06:27:05 +0000 2021,"@muhammadbmasood Many Congratulations.
What was the event back in covid?
Seems like you married twice to the same person :P
Pretty couple"
1442369394059907074,,Mon Sep 27 06:03:56 +0000 2021,"@_Be_ware What you think of fake marks of just three papers for two year. Covid examination marks are nothing, we need tough test for medical enterence."
1442361618315104257,,Mon Sep 27 05:33:02 +0000 2021,Sydney eases lockdown eases for the vaccinated https://t.co/XFvZiSRM1e
