ID,Tags,Created At,Text
1435305773085626372,,Tue Sep 07 18:15:37 +0000 2021,"@Amit_Dogra01 @shourietweets @majorgauravarya Get some knowledge INDIOT.
ENDIA has the largest Foreign Dept in the World of 550 Billion $,while Pakistan has only 115 Billion $.
BHIKARISTAN was begging entire world during Covid &amp; for Oxygen.
Tum log alag level ke BHIKARI HO.
Next Time get this fact before Shitting on Twitter"
1435305611957350400,,Tue Sep 07 18:14:59 +0000 2021,"@shourietweets @majorgauravarya Get some knowledge INDIOT.
ENDIA has the largest Foreign Dept in the World of 550 Billion $,while Pakistan has only 115 Billion $.
BHIKARISTAN was begging entire world during Covid &amp; for Oxygen.
Tum logo alag level ke BHIKARI HO.
Next Time get this fact before Shitting on Twitter"
1435292598516781069,,Tue Sep 07 17:23:16 +0000 2021,"What was the purpose of vaccination then? Meanwhile, Political parties with their activities (such as rallies their gathering in different areas of the country, Anaugeration ceremonies) is trying to give messages like '' There is no Corona virus, while simultaneously the"
1435292595689754624,,Tue Sep 07 17:23:15 +0000 2021,"We have observed the policies of Govt, related to COVID-19, A prominent DC of the Islamabad Issued notification regarding closure of Educational Institutions and Inter-city transport.

One should ask; If still closure of Educational institutions is your answer to COVID-19"
1435265810902179846,mentalhealthawareness covid_19 psychiatrist kthmtipeshawar,Tue Sep 07 15:36:49 +0000 2021,"A Facebook live session on ""Covid 19 &amp; Mental Health"" with Asst. Prof. Dr. Imran Khan, Chairman Department of Psychiatry MTI KTH Peshawar.
Wednesday, 8 Sep 2021 at Noon.
Ask your questions in comment box.

#mentalhealthawareness #covid_19 #psychiatrist #kthmtipeshawar https://t.co/xi0XgaHF1p"
1435232185779372035,,Tue Sep 07 13:23:13 +0000 2021,Vietnam: Man gets 5 years jail for spreading Covid https://t.co/RRAtbWfYrk
1435229626213801993,,Tue Sep 07 13:13:02 +0000 2021,"@majorgauravarya Maj Gobar.
1st of all Endia itself a Bhikari nation has the largest foreign debt in the world of 550 billion $. They were begging entire world during Covid &amp; for Oxygen.
2ndly If they were looking for money, why they kicked out your Asses frm Afghanistan &amp; other rich Countries?🤣"
1435207963879280646,WHO,Tue Sep 07 11:46:58 +0000 2021,"#WHO Representative in 🇵🇰 , Dr Palitha Mahipala met with VC, Khyber Medical University, Peshawar,Dr Zia and discussed the current situation of COVID-19.
He also visited Provincial Public Health Reference Lab(PPHRL)and met the Lab Director,Dr Yasir Yousafzai &amp;the technical staff. https://t.co/YiyxiM2PBe"
1435173518518456322,,Tue Sep 07 09:30:05 +0000 2021,New Zealand to procure more COVID-19 vaccines https://t.co/9kG4lCKUfa
