ID,Tags,Created At,Text
1428447856202035200,,Thu Aug 19 20:04:42 +0000 2021,Do Americans have the resolve to face COVID-19 head-on? https://t.co/t8BoTB0ABz
1428421821901283332,,Thu Aug 19 18:21:15 +0000 2021,@rana_okarapti COVID-19???
1428412234884071426,,Thu Aug 19 17:43:10 +0000 2021,Being a public servant and tweeting about the processions amidst Corona Virus is very irresponsible behaviour.More irresponsibility is that why it even happened? https://t.co/dMlkZu24mb
1428395745934204929,,Thu Aug 19 16:37:38 +0000 2021,Covid hmmm https://t.co/LzqZaFWhzm
1428307660097589255,,Thu Aug 19 10:47:37 +0000 2021,"There is no COVID-19 for shia's in Karbala,Iraq for foreigners?while there is COVID-19 for foreigners in Makkah Mukarma,Saudi Arabia."
1428248133125935105,DualStandard,Thu Aug 19 06:51:05 +0000 2021,"@DCPeshawar @accity_peshawar @infokpgovt @PMRUKP Sir where is covid SOPs ?
As you have sealed and arrested a restaurant manager for violating SOPs .....
In restaurants there are hardly 10 to 20 people... #DualStandard"
