ID,Tags,Created At,Text
1426309494171127814,,Fri Aug 13 22:27:37 +0000 2021,Covid has changed so much for us. things that would have not crossed our mind even. it actually so crazy
1426264912133767171,,Fri Aug 13 19:30:28 +0000 2021,@NadraMedia No result for search of pak covid 19 vaccination pass
1426260457111883782,,Fri Aug 13 19:12:46 +0000 2021,"COVID-19 might only affect children in coming years, US-Norwegian study suggests https://t.co/972M4MuQUx"
1426196721969733637,,Fri Aug 13 14:59:30 +0000 2021,SCCI seeks special fiscal relief package for Covid-19 hit traders https://t.co/6AKACYhP8g
1426194918712692740,,Fri Aug 13 14:52:20 +0000 2021,Schools become COVID-19 battleground https://t.co/D7X3Q7VyBr
1426177976434008064,,Fri Aug 13 13:45:01 +0000 2021,WHO urges support for new COVID-19 origins studies https://t.co/ep221G338J
1426127273678315521,,Fri Aug 13 10:23:32 +0000 2021,Iran is struggling with its worst wave yet of the virus. https://t.co/BX9RndUZE3
1426088564417130500,,Fri Aug 13 07:49:43 +0000 2021,Global trade fears as Covid hits major China port https://t.co/nlgPeAOo4B
1426048246196031490,,Fri Aug 13 05:09:31 +0000 2021,"Pakistan reports 4,619 COVID-19 cases in 24 hours https://t.co/a0IqOMMRsE"
