ID,Tags,Created At,Text
1455230806268518400,,Mon Nov 01 17:50:35 +0000 2021,"Covid-19 claims one more life, infects 239 others in Sindh https://t.co/RAmiFblGWO"
1455227288384163853,,Mon Nov 01 17:36:37 +0000 2021,Three labs services suspended on issuing fake COVID-19 reports https://t.co/heFxUBooFY
1455223300708356102,,Mon Nov 01 17:20:46 +0000 2021,COVID-19 killed 5 million people around the globe. What next? https://t.co/9x4x3kDvUT
1455211401308479493,,Mon Nov 01 16:33:29 +0000 2021,"‘We financed.’ In the US, told about the origin of COVID-19 https://t.co/DlhI4en7q5"
1455205220682715137,,Mon Nov 01 16:08:55 +0000 2021,2.6m afs embezzled in Covid-19 fund https://t.co/l1GHWe4muC
